title,author,publisher,image_url,published_year,average_rating,ratings_count,num_pages
"The Morning After: Sex, Fear, and Feminism on Campus",Katie Roiphe,Little Brown &amp; Co,http://images.amazon.com/images/P/0316754315.01.LZZZZZZZ.jpg,1993,3.95,992,867
LAST TEMPTATION OF CHRIST (Movie Tie in),Nikos Kazantzakis,Touchstone,http://images.amazon.com/images/P/0671672576.01.LZZZZZZZ.jpg,1988,4.46,339,729
The Informers,BRET EASTON ELLIS,Vintage,http://images.amazon.com/images/P/0679743243.01.LZZZZZZZ.jpg,1995,3.3,888,826
Africans in America: AMERICAN (AMERI)ca's Journey through Slavery,Charles Johnson,Harcourt,http://images.amazon.com/images/P/0151003394.01.LZZZZZZZ.jpg,1998,2.12,877,653
The Rainmaker,John Grisham,Doubleday Books,http://images.amazon.com/images/P/0385424736.01.LZZZZZZZ.jpg,1995,3.7,839,545
Love in Black and White: The Triumph of Love over Prejudice and Taboo,Mark Mathabane,HarperCollins,http://images.amazon.com/images/P/0060923717.01.LZZZZZZZ.jpg,1993,0.2,443,671
The Color Purple,Alice Walker,Pocket Books,http://images.amazon.com/images/P/0671617028.01.LZZZZZZZ.jpg,1985,0.04,292,116
Mirror Image,Danielle Steel,Dell Publishing Company,http://images.amazon.com/images/P/0440224772.01.LZZZZZZZ.jpg,1999,3.23,643,154
The Shelter of Each Other: Rebuilding Our Families,Mary Bray Pipher,Ballantine Books,http://images.amazon.com/images/P/0345406036.01.LZZZZZZZ.jpg,1997,3.38,811,547
Story of My Life: A Novel,Jay McInerney,Pub Group West,http://images.amazon.com/images/P/0871132389.01.LZZZZZZZ.jpg,1988,3.04,110,372
The First Immortal,James L. Halperin,Del Rey Books,http://images.amazon.com/images/P/0345421825.01.LZZZZZZZ.jpg,1998,1.92,101,510
Diaspora,Greg Egan,Eos,http://images.amazon.com/images/P/0061057983.01.LZZZZZZZ.jpg,1999,2.66,674,190
Confucio nel computer: Memoria accidentale del futuro,Furio Colombo,Nuova Eri Rizzoli,http://images.amazon.com/images/P/8817844330.01.LZZZZZZZ.jpg,1995,4.53,393,78
And Babies Make Four  (Manhattan Multiples),Marie Ferrarella,Silhouette,http://images.amazon.com/images/P/0373245513.01.LZZZZZZZ.jpg,2003,5,113,757
Monster Movers,George Ancona,Penguin USA,http://images.amazon.com/images/P/0525440631.01.LZZZZZZZ.jpg,1983,0.09,838,903
The Tycoon's Double Trouble  (Daycare Dads),Susan Meier,Silhouette,http://images.amazon.com/images/P/0373196504.01.LZZZZZZZ.jpg,2003,1.74,24,466
Legacy of Evil,Anna Clarke,Berkley Pub Group,http://images.amazon.com/images/P/0425130312.01.LZZZZZZZ.jpg,1991,4.31,982,402
"The Spaniard's Woman   Foreign Affairs (Harlequin Presents, 2351)",Diana Hamilton,Harlequin,http://images.amazon.com/images/P/0373123515.01.LZZZZZZZ.jpg,2003,4.82,878,742
"The Greek Tycoon's Ultimatum   The Greek Tycoons (Harlequin Presents, 2353)",Lucy Monroe,Harlequin,http://images.amazon.com/images/P/0373123531.01.LZZZZZZZ.jpg,2003,1.69,520,496
The Firm (Random House Large Print),JOHN GRISHAM,Random House Large Print,http://images.amazon.com/images/P/0375433465.01.LZZZZZZZ.jpg,2004,3.53,631,218
Each Time We Love,Shirlee Busbee,Harper Mass Market Paperbacks,http://images.amazon.com/images/P/0380752123.01.LZZZZZZZ.jpg,1993,1.16,163,6
Murder on the Orient Express,Agatha Christie,Pocket Books,http://images.amazon.com/images/P/067170463X.01.LZZZZZZZ.jpg,1978,4.9,506,456
DEAD MANS FOLLY (Hercule Poirot Mysteries (Paperback)),Agatha Christie,Pocket,http://images.amazon.com/images/P/0671543180.01.LZZZZZZZ.jpg,1984,4.07,510,704
Endless Night,Agatha Christie,Pocket Books,http://images.amazon.com/images/P/067170091X.01.LZZZZZZZ.jpg,1990,2.7,622,338
Easy to Kill,Agatha Christie,Pocket Books,http://images.amazon.com/images/P/0671705997.01.LZZZZZZZ.jpg,1991,4.7,930,845
And Then There Were None,Agatha Christie,Pocket Books,http://images.amazon.com/images/P/0671704664.01.LZZZZZZZ.jpg,1989,4.32,22,934
A Careful Wife,Lindsay Armstrong,Harlequin,http://images.amazon.com/images/P/0373805217.01.LZZZZZZZ.jpg,2002,4.82,589,149
ABC MURDERS,Agatha Christie,Pocket,http://images.amazon.com/images/P/0671696513.01.LZZZZZZZ.jpg,1989,2.06,194,281
The Blind - Date Bride  (The Australians),Emma Darcy,Harlequin,http://images.amazon.com/images/P/0373123086.01.LZZZZZZZ.jpg,2003,1.21,768,479
The Adventures of Tom Sawyer,Mark Twain,Penguin Books,http://images.amazon.com/images/P/0140390839.01.LZZZZZZZ.jpg,1987,3.34,7,981
The Parisian Playboy   In Love With Her Boss,Helen Brooks,Harlequin,http://images.amazon.com/images/P/0373123523.01.LZZZZZZZ.jpg,2003,0.34,64,780
Faery Magic,Mary Jo Putney,Zebra Books,http://images.amazon.com/images/P/0821758179.01.LZZZZZZZ.jpg,1998,4.85,34,179
Tender Is the Storm,Johanna Lindsey,Avon,http://images.amazon.com/images/P/0380896931.01.LZZZZZZZ.jpg,1985,2.3,869,658
The Greatest Discovery,Chris Sorensen,Pond Publishing,http://images.amazon.com/images/P/0971942315.01.LZZZZZZZ.jpg,2003,2.01,516,593
Der Fisch lernt fliegen. Unterwegs durch die Jahre.,Erika Pluhar,Hoffmann &amp; Campe,http://images.amazon.com/images/P/3455059554.01.LZZZZZZZ.jpg,2000,3.3,540,428
Narcissus and Goldmund,Hermann Hesse,Bantam Books,http://images.amazon.com/images/P/0553275860.01.LZZZZZZZ.jpg,1984,1.63,355,13
Fronteras de Lo Imposible,Iker Jimenez,Edaf,http://images.amazon.com/images/P/844140898X.01.LZZZZZZZ.jpg,2001,1.88,820,633
Sin Noticias De Gurb (Biblioteca breve),Eduardo Mendoza,Planeta Pub Corp,http://images.amazon.com/images/P/8432206407.01.LZZZZZZZ.jpg,1995,3.26,592,945
The Da Vinci Code,DAN BROWN,Random House Audio,http://images.amazon.com/images/P/0739307312.01.LZZZZZZZ.jpg,2003,4.61,48,990
Name Der Rose,Umberto Eco,Distribooks Int'l+inc,http://images.amazon.com/images/P/3423105518.01.LZZZZZZZ.jpg,0,4.22,870,395
2001 Spanish and English Idioms/2001 Modismos Espanoles E Ingleses: 2001 Modismos Espanoles E Ingleses,"Eugene, Ph.D. Savaiano",Barron's Educational Series,http://images.amazon.com/images/P/0812090284.01.LZZZZZZZ.jpg,1995,4.99,265,850
Spring Fever!,Peter Lerangis,Scholastic,http://images.amazon.com/images/P/0590254715.01.LZZZZZZZ.jpg,1996,2.9,115,398
"Mi Gato Angus, El Primer Morreo Y El Pasta",Louise Rennison,Distribooks,http://images.amazon.com/images/P/8478886818.01.LZZZZZZZ.jpg,2002,2.94,948,625
Pozo y El Pendulo y Otras Historias Espeluzna,Edgar Allan Poe,Valdemar,http://images.amazon.com/images/P/8477021473.01.LZZZZZZZ.jpg,1998,0.11,675,586
La educación de un hada,Didier Van Cauwelaert,Santillana USA Publishing Company,http://images.amazon.com/images/P/8420443026.01.LZZZZZZZ.jpg,2001,2.7,37,81
El Circulo Magico,Katherine Neville,Ediciones B,http://images.amazon.com/images/P/8440682441.01.LZZZZZZZ.jpg,1998,0.4,79,538
13 99 Euros,Frederic Beigbeder,Anagrama,http://images.amazon.com/images/P/843396951X.01.LZZZZZZZ.jpg,2002,2.7,292,764
"Ocho, El",Katherine Neville,Grupo Zeta,http://images.amazon.com/images/P/8440616368.01.LZZZZZZZ.jpg,1991,4.82,678,567
Mitologia - Guia Ilustrada de Mitos del Mundo,Roy Willis,Debate,http://images.amazon.com/images/P/8474448174.01.LZZZZZZZ.jpg,1997,0.97,888,612
El club Dumas (edición en español),Arturo Perez-Reverte,"Alfaguara Ediciones, S.A. (Spain)",http://images.amazon.com/images/P/8420483885.01.LZZZZZZZ.jpg,1999,4.34,855,285
Falso Movimiento (Gran Angular),Alejandro Gandara,Ediciones SM,http://images.amazon.com/images/P/8434845091.01.LZZZZZZZ.jpg,1998,1.86,841,932
El Ultimo Adios,Mary Higgins Clark,Distribooks,http://images.amazon.com/images/P/8484509125.01.LZZZZZZZ.jpg,2002,3.28,810,249
LA Tabla De Flandes,Arturo Perez Reverte,Distribooks,http://images.amazon.com/images/P/8484500020.01.LZZZZZZZ.jpg,2003,2.55,426,152
Patience and Sarah,Isabel Miller,Fawcett Books,http://images.amazon.com/images/P/0449210073.01.LZZZZZZZ.jpg,1985,2.33,637,984
The Notebook,Nicholas Sparks,Warner Books,http://images.amazon.com/images/P/0446605239.01.LZZZZZZZ.jpg,1998,2.34,823,599
Carnal Innocence,Nora Roberts,Bantam Books,http://images.amazon.com/images/P/0553295977.01.LZZZZZZZ.jpg,1992,1.15,200,7
The Fulfillment,LaVyrle Spencer,Avon,http://images.amazon.com/images/P/0380470845.01.LZZZZZZZ.jpg,1979,3.51,378,507
"Mattimeo (Redwall, Book 3)",Brian Jacques,Avon Books,http://images.amazon.com/images/P/0380715309.01.LZZZZZZZ.jpg,1998,3.23,356,669
If I Should Die,Judith Kelman,Bantam Books,http://images.amazon.com/images/P/0553291025.01.LZZZZZZZ.jpg,1993,4.6,619,21
The Wood Wife (Tor Fantasy),Terri Windling,Tor Books,http://images.amazon.com/images/P/0812549295.01.LZZZZZZZ.jpg,1997,3.03,559,926
North and South,John Jakes,Dell Publishing Company,http://images.amazon.com/images/P/0440162041.01.LZZZZZZZ.jpg,1983,1.27,970,191
Lost Lady,Jude Deveraux,Pocket,http://images.amazon.com/images/P/0671739778.01.LZZZZZZZ.jpg,1991,0.6,300,930
Italy in Mind: An Anthology (Vintage Departures),Alice Leccese Powers,Vintage Books USA,http://images.amazon.com/images/P/0679770232.01.LZZZZZZZ.jpg,1997,4.69,100,494
White As Snow (Fairy Tales),Tanith Lee,Tor Books,http://images.amazon.com/images/P/0312875495.01.LZZZZZZZ.jpg,2001,1.62,708,502
Overload,Arthur Hailey,Bantam Doubleday Dell,http://images.amazon.com/images/P/0553130285.01.LZZZZZZZ.jpg,2000,4.39,109,357
Cold Sassy Tree,Olive Ann Burns,Bantam Doubleday Dell,http://images.amazon.com/images/P/0440212723.01.LZZZZZZZ.jpg,1992,2.18,864,637
Ancient Shores,Jack McDevitt,Eos,http://images.amazon.com/images/P/0061054267.01.LZZZZZZZ.jpg,1996,0.69,17,770
Reap the Whirlwind: The Battle of the Rosebud June 1876 (Plainsmen (Paperback)),Terry C. Johnston,Bantam Books,http://images.amazon.com/images/P/0553299743.01.LZZZZZZZ.jpg,1995,3.86,888,238
Bloodstream,Tess Gerritsen,Pocket,http://images.amazon.com/images/P/0671016768.01.LZZZZZZZ.jpg,1999,3.92,575,8
No Comebacks: Collected Short Stories,Frederick Forsyth,Bantam Books,http://images.amazon.com/images/P/0553276735.01.LZZZZZZZ.jpg,1983,0.61,587,416
Burning Angel (Dave Robicheaux Mysteries (Paperback)),James Lee Burke,Hyperion,http://images.amazon.com/images/P/0786889047.01.LZZZZZZZ.jpg,1996,1.75,613,722
The List of 7,Mark Frost,Avon,http://images.amazon.com/images/P/0380720191.01.LZZZZZZZ.jpg,1994,3.25,844,704
So Worthy My Love,Kathleen E. Woodiwiss,Harpercollins,http://images.amazon.com/images/P/0380898179.01.LZZZZZZZ.jpg,1989,4.09,355,837
Blue Adept (Apprentice Adept (Paperback)),Piers Anthony,Ballantine Books,http://images.amazon.com/images/P/0345314247.01.LZZZZZZZ.jpg,1982,0.36,128,669
Heat and Dust,Ruth Prawer Jhabvala,Touchstone,http://images.amazon.com/images/P/0671646575.01.LZZZZZZZ.jpg,1987,1.17,818,971
Veronika Decides to Die,Paulo Coelho,Perennial,http://images.amazon.com/images/P/0060955775.01.LZZZZZZZ.jpg,2001,1.99,737,855
Manifold Destiny: The One! the Only! Guide to Cooking on Your Car Engine,Chris Maynard,Villard Books,http://images.amazon.com/images/P/0679723374.01.LZZZZZZZ.jpg,1989,0.93,672,83
Treehouses: The Art and Craft of Living Out on a Limb,Peter Nelson,Mariner Books,http://images.amazon.com/images/P/0395629497.01.LZZZZZZZ.jpg,1994,0.97,494,46
Home Tree Home: Principles of Treehouse Construction and Other Tall Tales,Peter Nelson,Penguin Books,http://images.amazon.com/images/P/0140259988.01.LZZZZZZZ.jpg,1997,0.78,115,348
The Royal Physician's Visit: A Novel,Per Olov Enquist,Washington Square Press,http://images.amazon.com/images/P/0743458036.01.LZZZZZZZ.jpg,2002,4,623,614
Falcon,Emma Bull,Ace Books,http://images.amazon.com/images/P/0441225691.01.LZZZZZZZ.jpg,1989,1.57,232,672
"The Honor of the Queen (Honor Harrington Series, Book 2)",David Weber,Baen,http://images.amazon.com/images/P/0671721720.01.LZZZZZZZ.jpg,1993,3.53,784,277
The Man on the Balcony: The Story of a Crime (Vintage Crime/Black Lizard),Maj Sjowall,Vintage Books USA,http://images.amazon.com/images/P/0679745963.01.LZZZZZZZ.jpg,1993,2.01,464,966
"The Short Victorious War (Honor Harrington Series, Book 3)",David Weber,Baen,http://images.amazon.com/images/P/0671875965.01.LZZZZZZZ.jpg,1994,0.14,654,85
The Disappearance of Sherlock Holmes,Larry Millett,Penguin Books,http://images.amazon.com/images/P/0142003409.01.LZZZZZZZ.jpg,2003,3.77,264,839
"On Basilisk Station (Honor Harrington Series, Book 1)",David Weber,Baen,http://images.amazon.com/images/P/0671577727.01.LZZZZZZZ.jpg,1998,3.99,760,799
Reaper Man,Terry Pratchett,New Amer Library,http://images.amazon.com/images/P/0451451686.01.LZZZZZZZ.jpg,1992,3.62,192,48
"Between Silk and Cyanide: A Codemaker's War, 1941-1945",Leo Marks,Free Press,http://images.amazon.com/images/P/068486780X.01.LZZZZZZZ.jpg,2000,3.44,871,9
A Beautiful Mind: The Life of Mathematical Genius and Nobel Laureate John Nash,Sylvia Nasar,Simon &amp; Schuster,http://images.amazon.com/images/P/0743224574.01.LZZZZZZZ.jpg,2001,0.1,183,528
"GONE FISHIN : Featuring an Original Easy Rawlins Short Story \""Smoke\"" (Easy Rawlins Mysteries (Paperback))",Walter Mosley,Pocket,http://images.amazon.com/images/P/0671010115.01.LZZZZZZZ.jpg,1998,0.1,170,427
You Belong To Me,Mary Higgins Clark,Pocket Books,http://images.amazon.com/images/P/0671004549.01.LZZZZZZZ.jpg,1999,2.55,814,10
The Threatening Storm: The Case for Invading Iraq,Kenneth M. Pollack,Random House,http://images.amazon.com/images/P/0375509283.01.LZZZZZZZ.jpg,2002,4.36,534,703
Reading Lolita in Tehran: A Memoir in Books,Azar Nafisi,Random House Trade Paperbacks,http://images.amazon.com/images/P/081297106X.01.LZZZZZZZ.jpg,2003,4.33,957,619
Blue Latitudes : Boldly Going Where Captain Cook Has Gone Before,Tony Horwitz,Picador,http://images.amazon.com/images/P/0312422601.01.LZZZZZZZ.jpg,2003,1.57,9,559
Peace Like a River,Leif Enger,Grove Press,http://images.amazon.com/images/P/0802139256.01.LZZZZZZZ.jpg,2002,4.35,841,105
Embraced by the Light,Betty J. Eadie,Bantam Books,http://images.amazon.com/images/P/0553565915.01.LZZZZZZZ.jpg,1994,1.66,392,582
Cry Wolf,TAMI HOAG,Bantam,http://images.amazon.com/images/P/055356160X.01.LZZZZZZZ.jpg,1993,1.06,445,816
"The Power of Two (T*Witches, No 1)",H. B. Gilmour,Apple,http://images.amazon.com/images/P/0439240700.01.LZZZZZZZ.jpg,2001,2.45,725,351
Magic Kingdom for Sale - Sold! (Magic Kingdom of Landover),Terry Brooks,Del Rey Books,http://images.amazon.com/images/P/0345317580.01.LZZZZZZZ.jpg,1990,3.67,668,362
The Black Unicorn (Magic Kingdom of Landover Novel),Terry Brooks,Del Rey Books,http://images.amazon.com/images/P/0345335287.01.LZZZZZZZ.jpg,1990,4.1,235,883
Wizard at Large (Rookies Series),Terry Brooks,Del Rey Books,http://images.amazon.com/images/P/0345362276.01.LZZZZZZZ.jpg,1989,4.63,489,283
Sweet Enemy,Diana Palmer,Silhouette,http://images.amazon.com/images/P/0373512066.01.LZZZZZZZ.jpg,2002,2.4,915,810
The Time Machine,H. G. Wells,Tor Books,http://images.amazon.com/images/P/0812505042.01.LZZZZZZZ.jpg,1995,0.71,286,604
The Invisible Man (Dover Thrift Editions),H. G. Wells,Dover Publications,http://images.amazon.com/images/P/0486270718.01.LZZZZZZZ.jpg,1992,4.15,391,243
Journey to the Center of the Earth,Jules Verne,Penguin Books,http://images.amazon.com/images/P/0140022651.01.LZZZZZZZ.jpg,1965,4.32,620,67
Bradymania!: Everything You Always Wanted to Know - And a Few Things You Probably Didnt (25th Anniversary Edition),Elizabeth Moran,Adams Media Corporation,http://images.amazon.com/images/P/1558504184.01.LZZZZZZZ.jpg,1995,1.2,882,11
"The Message (Animorphs , No 4)",K. A. Applegate,Scholastic,http://images.amazon.com/images/P/0590629808.01.LZZZZZZZ.jpg,1996,2.67,544,487
"The Invasion (Animorphs, No 1)",K. A. Applegate,Scholastic,http://images.amazon.com/images/P/0590629778.01.LZZZZZZZ.jpg,1996,0.24,608,558
The Yearbook,Peter Lerangis,Scholastic,http://images.amazon.com/images/P/059046678X.01.LZZZZZZZ.jpg,1994,0.66,292,962
SCREAM OF THE CAT (PHANTOM VALLEY ) : SCREAM OF THE CAT,Lynn Beach,Aladdin,http://images.amazon.com/images/P/0671740903.01.LZZZZZZZ.jpg,1992,4.67,636,15
EVIL ONE (PHANTOM VALLEY 1) : EVIL ONE (Phantom Valley),Lynn Beach,Aladdin,http://images.amazon.com/images/P/0671740881.01.LZZZZZZZ.jpg,1991,2.46,859,709
How to Talk So Kids Will Listen and Listen So Kids Will Talk,Adele Faber,Back Bay Books,http://images.amazon.com/images/P/0380570009.01.LZZZZZZZ.jpg,1991,2.29,974,973
Farrah : An Unauthorized Biography of Farrah Fawcett-Majors,Patricia Burstein,Signet Books,http://images.amazon.com/images/P/0451077237.01.LZZZZZZZ.jpg,1977,0.96,339,299
Graveyard of the Atlantic: Shipwrecks of the North Carolina Coast,David Stick,University of North Carolina Press,http://images.amazon.com/images/P/0807842613.01.LZZZZZZZ.jpg,1989,1.81,409,290
Han Solo at Stars' End,Daley,Not Avail,http://images.amazon.com/images/P/0345283554.01.LZZZZZZZ.jpg,1979,2.37,728,457
Splinter of the Mind's Eye,Alan Dean Foster,Ballantine Books,http://images.amazon.com/images/P/0345260627.01.LZZZZZZZ.jpg,1978,2.78,421,398
Empire Strikes Back Wars,Donald F Glut,Ballantine Books,http://images.amazon.com/images/P/0345283929.01.LZZZZZZZ.jpg,1980,4.08,705,651
Close Friends,Peter Jenkins,Harpercollins,http://images.amazon.com/images/P/068808527X.01.LZZZZZZZ.jpg,1989,4.77,397,607
50 Simple Things You Can Do to Save the Earth,Earthworks Group,Pub Group West,http://images.amazon.com/images/P/0929634063.01.LZZZZZZZ.jpg,1989,0.14,974,651
"A Hiker's Companion: 12,000 Miles of Trail-Tested Wisdom",Cindy Ross,Mountaineers Books,http://images.amazon.com/images/P/0898863538.01.LZZZZZZZ.jpg,1993,1.06,168,326
Hiking a Celebration of the Sport and the World's Best Places to Enjoy It (Fodor's sports),Cindy Ross,Random House Inc,http://images.amazon.com/images/P/0679023755.01.LZZZZZZZ.jpg,1992,4.51,907,814
Hungry Hikers Book of Good Cooking,Gretchen McHugh,Alfred A. Knopf,http://images.amazon.com/images/P/0394707745.01.LZZZZZZZ.jpg,1982,1.85,15,520
The Cat Who... Companion,Sharon A. Feaster,Berkley Publishing Group,http://images.amazon.com/images/P/042516540X.01.LZZZZZZZ.jpg,1998,3.38,332,268
"FOREVER : A Novel of Good and Evil, Love and Hope",Judy Blume,Pocket,http://images.amazon.com/images/P/0671695304.01.LZZZZZZZ.jpg,1989,2.82,168,102
The Cat Who Went Up the Creek,Lilian Jackson Braun,Jove Books,http://images.amazon.com/images/P/0515134384.01.LZZZZZZZ.jpg,2003,1.71,446,369
The Cat Who Sang for the Birds (Cat Who... (Paperback)),Lilian Jackson Braun,Jove Books,http://images.amazon.com/images/P/051512463X.01.LZZZZZZZ.jpg,1999,0.35,509,490
HIGH TIDE FEAR STREET SUPERCHILLER 12,R.L. Stine,Simon Pulse,http://images.amazon.com/images/P/0671529714.01.LZZZZZZZ.jpg,1997,3.86,340,50
First Evil (Fear Street Cheerleaders 1) : First Evil,R.L. Stine,Simon Pulse,http://images.amazon.com/images/P/0671751174.01.LZZZZZZZ.jpg,1992,0.62,233,447
BODY SWITCHERS FROM OUTER SPACE: R L STINE'S GHOSTS OF FEAR STREET #14 (GHOSTS OF FEAR STREET),R.L. Stine,Aladdin,http://images.amazon.com/images/P/0671001868.01.LZZZZZZZ.jpg,1996,1.95,166,573
"The Elf Queen of Shannara (Heritage of Shannara, Book 3)",Terry Brooks,Del Rey Books,http://images.amazon.com/images/P/0345375580.01.LZZZZZZZ.jpg,1993,1.29,650,762
JUDY GARLAND,Anne E. Edwards,Pocket,http://images.amazon.com/images/P/0671802283.01.LZZZZZZZ.jpg,1975,3.97,107,510
STAR TREK YESTERDAY'S SON (Star Trek: The Original Series),A.C. Crispin,Audioworks,http://images.amazon.com/images/P/067166865X.01.LZZZZZZZ.jpg,1988,3.72,199,599
Perfect Girls (Replica No. 4),Marilyn Kaye,Skylark Books,http://images.amazon.com/images/P/0553492411.01.LZZZZZZZ.jpg,1999,4.19,332,955
"The Andalite Chronicles (Elfangor's Journey, Alloran's Choice, An Alien Dies) - Animorphs",Katherine Applegate,Apple,http://images.amazon.com/images/P/0590109715.01.LZZZZZZZ.jpg,1997,0.38,896,214
"The Visitor (Animorphs, No 2)",K. A. Applegate,Scholastic,http://images.amazon.com/images/P/0590629786.01.LZZZZZZZ.jpg,1996,1.57,171,888
"The Encounter (Animorphs , No 3)",K. A. Applegate,Scholastic,http://images.amazon.com/images/P/0590629794.01.LZZZZZZZ.jpg,1996,2.71,282,125
"Shipwreck (Island, Book 1)",Gordon Korman,Hyperion Books for Children,http://images.amazon.com/images/P/0439164567.01.LZZZZZZZ.jpg,2001,4.84,919,114
"Karen's School Trip (Baby-Sitters Little Sister, 24)",Ann M. Martin,Scholastic Paperbacks (Mm),http://images.amazon.com/images/P/0590448595.01.LZZZZZZZ.jpg,1992,4.84,573,437
"Karen's Doll (Baby-Sitters Little Sister, 23)",Ann M. Martin,Scholastic,http://images.amazon.com/images/P/0590448323.01.LZZZZZZZ.jpg,1991,3.28,336,414
"Karen's Pen Pal (Baby-Sitters Little Sister, 25)",Ann M. Martin,Scholastic,http://images.amazon.com/images/P/0590448315.01.LZZZZZZZ.jpg,1992,1.51,552,832
The Christie Caper,Carolyn G. Hart,Bantam,http://images.amazon.com/images/P/0553295691.01.LZZZZZZZ.jpg,1999,1.79,332,271
Southern Ghost,Carolyn G. Hart,Bantam Books,http://images.amazon.com/images/P/0553562754.01.LZZZZZZZ.jpg,1996,1.75,146,436
Montana Sky,Nora Roberts,Jove Books,http://images.amazon.com/images/P/0515120618.01.LZZZZZZZ.jpg,2000,1.3,418,568
A Thousand Country Roads: An Epilogue to The Bridges of Madison County,Robert James Waller,John M. Hardy,http://images.amazon.com/images/P/0971766711.01.LZZZZZZZ.jpg,2002,2.81,677,113
Macromedia Dreamweaver 4: Training from the Source,Khristine Page,Macromedia Press,http://images.amazon.com/images/P/0201731355.01.LZZZZZZZ.jpg,2001,3.49,478,337
All About Passion (Cynster Novels),Stephanie Laurens,Avon,http://images.amazon.com/images/P/0380812029.01.LZZZZZZZ.jpg,2001,3.53,526,786
Fifth Daughter,Elaine Coffman,Mira,http://images.amazon.com/images/P/1551668424.01.LZZZZZZZ.jpg,2001,4.1,158,205
To Kiss a Spy (Get Connected Romances),JANE FEATHER,Bantam,http://images.amazon.com/images/P/0553583077.01.LZZZZZZZ.jpg,2003,1.21,879,278
Lady of Desire,Gaelen Foley,Ivy Books,http://images.amazon.com/images/P/0804119740.01.LZZZZZZZ.jpg,2003,2.36,154,133
The Rogue,Claire Delacroix,Warner Books,http://images.amazon.com/images/P/0446611107.01.LZZZZZZZ.jpg,2002,4.97,784,76
The Italian,Elaine Coffman,Mira,http://images.amazon.com/images/P/1551669463.01.LZZZZZZZ.jpg,2002,1.09,391,177
Scrooge Wore Spurs,Janet Dailey,Kensington Publishing Corporation,http://images.amazon.com/images/P/0821772252.01.LZZZZZZZ.jpg,2002,0.98,493,479
See Jane Score (Avon Romance),Rachel Gibson,Avon,http://images.amazon.com/images/P/0060009241.01.LZZZZZZZ.jpg,2003,0.74,19,196
The Ring on Her Finger (Avon Romance),Elizabeth Bevarly,Avon,http://images.amazon.com/images/P/0380819619.01.LZZZZZZZ.jpg,2002,2.24,581,939
Reckless Encounter,Rosemary Rogers,Mira,http://images.amazon.com/images/P/1551668521.01.LZZZZZZZ.jpg,2001,1.49,325,889
Finding You/Knowing You : Two Brand-New Novels For One Wonderful Price! (Candellano Family Trilogy),Maureen Child,St. Martin's Paperbacks,http://images.amazon.com/images/P/0312989202.01.LZZZZZZZ.jpg,2003,0.71,945,278
Impostress (Signet Historical Romance),Lisa Jackson,Signet Book,http://images.amazon.com/images/P/0451208293.01.LZZZZZZZ.jpg,2003,3.6,71,552
Savage Destiny (Savage),Cassie Edwards,Leisure Books,http://images.amazon.com/images/P/084395051X.01.LZZZZZZZ.jpg,2003,0.85,273,30
Bride Of Black Douglas (Mira),Elaine Coffman,Mira,http://images.amazon.com/images/P/1551665964.01.LZZZZZZZ.jpg,2000,2.49,201,490
Texas Bride (Leisure Historical Romance),Leigh Greenwood,Leisure Books,http://images.amazon.com/images/P/0843950676.01.LZZZZZZZ.jpg,2002,4.93,463,876
The Iron Rose,Marsha Canham,Signet Book,http://images.amazon.com/images/P/0451208153.01.LZZZZZZZ.jpg,2003,4.04,450,145
Love With the Proper Husband (Avon Historical Romance),Victoria Alexander,Avon,http://images.amazon.com/images/P/0060001453.01.LZZZZZZZ.jpg,2003,2.3,527,781
On a Wicked Dawn (Cynster Novels),Stephanie Laurens,Avon Books,http://images.amazon.com/images/P/0060002050.01.LZZZZZZZ.jpg,2002,1.04,771,326
The Italian's Trophy Mistress  (Mistress To A Millionaire),Diana Hamilton,Harlequin,http://images.amazon.com/images/P/0373123213.01.LZZZZZZZ.jpg,2003,0.14,577,769
Seduced by a Rogue,Connie Mason,Leisure Books,http://images.amazon.com/images/P/0843951346.01.LZZZZZZZ.jpg,2003,1.77,961,978
Naughty Marietta,Nan Ryan,Mira Books,http://images.amazon.com/images/P/1551666766.01.LZZZZZZZ.jpg,2003,0.81,865,233
The Love Knot,Rebecca Brandewyne,Mira,http://images.amazon.com/images/P/1551666855.01.LZZZZZZZ.jpg,2003,3.87,15,872
Racing Moon,Cassie Edwards,Signet Book,http://images.amazon.com/images/P/0451208412.01.LZZZZZZZ.jpg,2003,1.27,317,318
Breathing Room (Avon Romance),Susan Elizabeth Phillips,Avon Books,http://images.amazon.com/images/P/0061032093.01.LZZZZZZZ.jpg,2003,1.55,952,90
Deadly Caress (A Francesca Cahill Romance),Brenda Joyce,St. Martin's Paperbacks,http://images.amazon.com/images/P/0312989431.01.LZZZZZZZ.jpg,2003,1.3,812,959
Seduced,Pamela Britton,Warner Forever,http://images.amazon.com/images/P/0446611298.01.LZZZZZZZ.jpg,2003,1.42,503,329
The Very Virile Viking,Sandra Hill,Leisure Books,http://images.amazon.com/images/P/0843952059.01.LZZZZZZZ.jpg,2003,1.74,469,812
Untie My Heart,Judith Ivory,Avon,http://images.amazon.com/images/P/0380812975.01.LZZZZZZZ.jpg,2002,1.41,777,765
Midnight Confessions,CANDICE PROCTOR,Ivy Books,http://images.amazon.com/images/P/0345447174.01.LZZZZZZZ.jpg,2002,0.08,152,461
Stealing Heaven,Madeline Hunter,Bantam Books,http://images.amazon.com/images/P/0553583565.01.LZZZZZZZ.jpg,2002,0.55,764,657
The Ways of Grace,Linda Francis Lee,Ivy Books,http://images.amazon.com/images/P/0804119953.01.LZZZZZZZ.jpg,2002,0.48,493,738
Reckless Embrace (Leisure Historical Romance),Madeline Baker,Leisure Books,http://images.amazon.com/images/P/0843950803.01.LZZZZZZZ.jpg,2002,4.77,957,713
Kingdom Of Moonlight,Josie Litton,Bantam Books,http://images.amazon.com/images/P/0553583905.01.LZZZZZZZ.jpg,2002,0.51,465,836
"Married By Midnight (Harlequin Historical, No. 622)",Judith Stacy,Harlequin,http://images.amazon.com/images/P/0373292228.01.LZZZZZZZ.jpg,2002,1.14,23,429
Breaking All the Rules (Avon Light Contemporary Romances),Sue Civil-Brown,Avon,http://images.amazon.com/images/P/0060502312.01.LZZZZZZZ.jpg,2002,1.12,606,564
